{
  "constitution_id": "AEC-001",
  "title": "AIGC Engineering Constitution",
  "version": "1.0.0-draft",
  "authority_class": "constitution",
  "status": "proposed",
  "human_authority_path": "docs/governance/constitution/AIGC_ENGINEERING_CONSTITUTION.md",
  "machine_authority_path": "governance/constitution/aec_001.registry.json",
  "conflict_behavior": "pause_for_accountable_human_ruling",
  "default_compliance_state": "nonconformant_blocking",
  "articles": [
    {"id":"AEC-I","title":"Foundational Value","category":"quality","mandatory":true},
    {"id":"AEC-II","title":"Truth","category":"evidence","mandatory":true},
    {"id":"AEC-III","title":"Human Authority","category":"governance","mandatory":true},
    {"id":"AEC-IV","title":"Deny by Default","category":"authorization","mandatory":true},
    {"id":"AEC-V","title":"Least Privilege","category":"authorization","mandatory":true},
    {"id":"AEC-VI","title":"Evidence","category":"evidence","mandatory":true},
    {"id":"AEC-VII","title":"Evolution","category":"evolution","mandatory":true},
    {"id":"AEC-VIII","title":"Architecture","category":"architecture","mandatory":true},
    {"id":"AEC-IX","title":"Contract First","category":"contracts","mandatory":true},
    {"id":"AEC-X","title":"Identity and Attribution","category":"identity","mandatory":true},
    {"id":"AEC-XI","title":"Privacy","category":"privacy","mandatory":true},
    {"id":"AEC-XII","title":"Accessibility","category":"accessibility","mandatory":true},
    {"id":"AEC-XIII","title":"Security","category":"security","mandatory":true},
    {"id":"AEC-XIV","title":"Production Readiness","category":"readiness","mandatory":true},
    {"id":"AEC-XV","title":"Repository Governance","category":"repository","mandatory":true},
    {"id":"AEC-XVI","title":"AI Role Boundaries","category":"ai_governance","mandatory":true},
    {"id":"AEC-XVII","title":"Public Trust","category":"public_trust","mandatory":true},
    {"id":"AEC-XVIII","title":"Evolution Engine Governance","category":"evolution","mandatory":true},
    {"id":"AEC-XIX","title":"Procurement Lifecycle","category":"procurement","mandatory":true},
    {"id":"AEC-XX","title":"Engineering Excellence","category":"quality","mandatory":true},
    {"id":"AEC-XXI","title":"Simplicity","category":"architecture","mandatory":true},
    {"id":"AEC-XXII","title":"Determinism","category":"quality","mandatory":true},
    {"id":"AEC-XXIII","title":"Observability","category":"operations","mandatory":true},
    {"id":"AEC-XXIV","title":"Recoverability","category":"recovery","mandatory":true},
    {"id":"AEC-XXV","title":"Compatibility","category":"contracts","mandatory":true},
    {"id":"AEC-XXVI","title":"Stewardship","category":"governance","mandatory":true},
    {"id":"AEC-XXVII","title":"Continuous Improvement","category":"quality","mandatory":true},
    {"id":"AEC-XXVIII","title":"Explainability","category":"public_trust","mandatory":true},
    {"id":"AEC-XXIX","title":"Modularity","category":"architecture","mandatory":true},
    {"id":"AEC-XXX","title":"Interoperability","category":"integrations","mandatory":true},
    {"id":"AEC-XXXI","title":"Resilience","category":"operations","mandatory":true},
    {"id":"AEC-XXXII","title":"Ethical Engineering","category":"ethics","mandatory":true}
  ],
  "invariants": [
    "NO_COMPLETION_CLAIM_WITHOUT_EVIDENCE",
    "NO_CONSEQUENTIAL_ACTION_WITHOUT_AUTHORITY",
    "NO_IMPLICIT_PERMIT",
    "NO_CROSS_TENANT_ACCESS",
    "NO_SECRET_MATERIAL_IN_REPOSITORY_CONFIGURATION",
    "NO_PRODUCTION_READY_CLAIM_WITH_BLOCKERS",
    "NO_MERGE_WITH_UNRESOLVED_MANDATORY_GATES",
    "NO_IMPLICIT_CONSTITUTIONAL_AMENDMENT",
    "NO_FALSE_HUMAN_OR_INDEPENDENCE_CLAIM",
    "NO_BLOCKING_FINDING_AVERAGED_AWAY"
  ],
  "compliance_states": [
    "conformant",
    "not_applicable",
    "exception_requested",
    "nonconformant_blocking"
  ],
  "amendment_requires": [
    "dedicated_pull_request",
    "affected_articles",
    "rationale",
    "risk_and_threat_analysis",
    "compatibility_assessment",
    "migration",
    "rollback",
    "version_increment",
    "review_path",
    "operator_ratification",
    "amendment_receipt"
  ],
  "external_action_performed": false
}
